name,company,job_url,salary,description
Software Engineer,BigID,https://ua.linkedin.com/jobs/view/software-engineer-at-bigid-3875339852?refId=Q8jJ8LRMvxbee%2BBIhmAHoA%3D%3D&trackingId=m1bp73e%2BQtTa0rUsYjdmmQ%3D%3D&position=20&pageNum=0&trk=public_jobs_jserp-result_search-card,not-found,"Who we are:BigID is an innovative tech startup that focuses on solutions for data security, compliance, privacy, and governance. We're leading the market in all things data: helping our customers reduce risk, drive business innovation, achieve compliance, build customer trust, make better decisions, and get more value from their data.We are building a global team with a passion for innovation and next-gen technology. BigID has been recognized for being one of CNBC’s Top 25 Startups powering the economy, we're on Built In's 2023 Best Places to Work, one of America's fastest-growing companies, Inc5000 2023, 3 years running, one of the 20 coolest identity access management and data protection companies, CRN Security 100 2023, a Market Leader in DSPM at the 11th annual Global InfoSec Awards (Cyber Defense Magazine) and 2023 Disruptor Gold Winner - Most Disruptive Cyber Security Software, Globee Awards.At BigID, our team is the foundation of our success. Join a people-centric culture that is fast-paced and rewarding: you’ll have the opportunity to work with some of the most talented people in the industry who value innovation, diversity, integrity, and collaboration.Who we seek:We’re looking for a software engineer with a ""can do anything"" spirit for our Team.This team’s super interesting and challenging mission is to build software that handles data discovery and classification for our customer's sensitive data - accurately and at scale.As a software engineer in the data platform group, you'll be responsible for building services and products and bringing innovation to the team's developments.What you’ll do:Design logical solutions to complex challenges for our customers who are among the most successful enterprises in the world.Write high-quality code, covered by solid unit and integration tests.Review the design and code for other team members.What you’ll bring:BS in Computer Science, Software Engineering or equivalent3+ years of hands-on experience in backend development: Recent Java and Spring Framework knowledge, and JS/TSDeep understanding of API protocolsExperience with micro-services architecture and messagingExperience with MongoDB technologyA can-do-attitudeAdvantages:Experience with ElasticSearch DBExperience in Agile developmentAWS, Docker, KubernetesWhat’s in it for you?!Our people are the foundation of our success, and we prioritize offering a wide range of benefits that make our team happier and healthier.Equity participation - everyone shares in our successFlexible work arrangementsOther compulsory benefits based on country of residenceOur Values:We look for people who embody our values -Care, Do, Try & Shine.Care - We care about our customers and each otherDo - We do what it takes to make a positive impactTry - We try our best and we don’t give upShine - We shine and make it our mission to always stand outBigDiversity:We’re committed to creating a culture of inclusion, diversity, and equality – across race, gender, sexuality, disability, and neurodiversity – where innovation and growth thrive, every voice is heard, and everybody belongs. Learn more about us here.CPRA Employee Privacy Notice: CABigID is an E-Verify Participant.Show moreShow less"
Senior Product Manager,BigID,https://il.linkedin.com/jobs/view/senior-product-manager-at-bigid-3900837631?refId=Q8jJ8LRMvxbee%2BBIhmAHoA%3D%3D&trackingId=pJMSglgGXkCYfO25xROPaA%3D%3D&position=10&pageNum=0&trk=public_jobs_jserp-result_search-card,not-found,"Who we are:BigID is an innovative tech startup that focuses on solutions for data security, compliance, privacy, and governance. We're leading the market in all things data: helping our customers reduce risk, drive business innovation, achieve compliance, build customer trust, make better decisions, and get more value from their data.We are building a global team with a passion for innovation and next-gen technology. BigID has been recognized for being one of CNBC’s Top 25 Startups powering the economy, we're on Built In's 2023 Best Places to Work, one of America's fastest-growing companies, Inc5000 2023, 3 years running, one of the 20 coolest identity access management and data protection companies, CRN Security 100 2023, a Market Leader in DSPM at the 11th annual Global InfoSec Awards (Cyber Defense Magazine) and 2023 Disruptor Gold Winner - Most Disruptive Cyber Security Software, Globee Awards.At BigID, our team is the foundation of our success. Join a people-centric culture that is fast-paced and rewarding: you’ll have the opportunity to work with some of the most talented people in the industry who value innovation, diversity, integrity, and collaboration.Who we seek:We’re looking for a Senior Product Manager to be a core member of the Product Management team, helping envision, design, develop, and deliver state-of-the-art products to the market.What you'll do:Lead the product activities for our rapidly growing platform - from vision to implementation, defining the product roadmap, working with engineering to build new solutions, and communicating with various internal stakeholders to ensure product successCollect, prioritize, and create product requirements for new featuresPerform ongoing analysis and research of customer requests, competitor capabilities, and industry trends in order to define the next product capabilitiesConduct regular customer calls deriving customer insights and tie those insights to business plans, product roadmaps and to prioritization processWork with our UX designers to create the optimal user experience for your productsLead sprint planning sessions, establishing clear goals for the development teams' forthcoming sprints based on the organization’s prioritiesWork closely with the engineering teams to make sure they understand the requirements and help drive executionWhat you'll bring:5+ years of experience in Product Management roles from a leading B2B companyExperience in managing enterprise-grade productStrong technical orientation and understandingAnalytical capabilities and strong problem-solving skillsAccountability, self-motivation, and ability to work autonomouslyAbility to uncover and understand customer needs and translate them into requirementsTeam player. A can-do attitude and ability to thrive in a fast-paced, startup environmentBusiness-minded and able to incorporate user and business needs into the decision-making processExcellent presentation and written and verbal communications skills, in both Hebrew and EnglishAdvantages:Background of a meaningful development experienceBachelor's degree in CS, Engineering, or related experience preferredExperience with cloud cyber security productsExperience with Access Management productsWhat’s in it for you?!Our people are the foundation of our success, and we place a high priority on offering a wide range of benefits that make our team happier and healthier.Equity participation - everyone shares in our successFlexible work arrangements - for parents, for remote work days, etc.Mentoring, Knowledge training & Career development tracksOffice perks: dog-friendly environment, fully-stocked fridge, gym and exercise classes, weekly Happy Hours, free parking, evening mealsOur Values:We look for people who embody our values - Care, Do, Try & Shine.Care - We care about our customers and each otherDo - We do what it takes to make a positive impactTry - We try our best and we don’t give upShine - We shine and make it our mission to always stand outBigDiversity:We’re committed to creating a culture of inclusion, diversity, and equality – across race, gender, sexuality, disability, and neurodiversity – where innovation and growth thrive, every voice is heard, and everybody belongs. Learn more about us here.CPRA Employee Privacy Notice: CABigID is an E-Verify Participant.Show moreShow less"
Customer Success Associate,AutoLeap,https://pk.linkedin.com/jobs/view/customer-success-associate-at-autoleap-3888109469?position=3&pageNum=0&refId=bzdYtCBZV7ramKKDf9k8KA%3D%3D&trackingId=C4MYFHWD75akL6nApZgVyg%3D%3D&trk=public_jobs_jserp-result_search-card,not-found,"AutoLeap is building a world-class Customer Experience practice, and we are looking for driven, talented, and passionate Customer Success Associates to help make it happen. This is a unique opportunity to join on the ground floor, drive tangible impact for customers, and shape our customer success playbook.About AutoLeapAutoLeap is a full-suite shop management software for the auto repair industry. We are on a mission to improve the lives of shop owners around the world by bringing modern software innovations to their underserved market. We are an international startup that values doing things differently and having fun along the way. Our leadership team consists of repeat CEOs, EY Entrepreneurs of the Year, Canada's Top 40 Under 40, and hails from BCG, Bain, Wharton and Stanford.As a Customer Success Associate, you will:Work directly with shop owners and their teams to realize greater value out of AutoLeap through deeper adoptionManage collections activities including contacting customers via phone and email, updating payment information, and collecting paymentsManage the support phone line and assist with customer product and billing questions incoming from that line, ensuring appropriate next actions are takenWork on other projects and initiatives of the Customer Success team on an as-needed basisNOTE: You will be required to work during North American work days & hours.To be successful in this role, you will need:8 - 24 months experience at a software company (bonus points for familiarity with the SaaS business model and experience serving SMB customers)Experience in a customer facing role, such as customer success or supportExperience working in collections or billing in some capacityOrganizational skills that will allow you to stay on top of multiple prioritiesStrong track record of success and progression in previous rolesPassion for helping others--you love seeing your customers get more out of your productYour own unique talents! If you don't meet 100% of the qualifications outlined above, tell us why you'd be a great fit for this roleShow moreShow less"
IT Ops Engineer,BigID,https://pt.linkedin.com/jobs/view/it-ops-engineer-at-bigid-3887297451?refId=Q8jJ8LRMvxbee%2BBIhmAHoA%3D%3D&trackingId=udOWqHZ%2F7VfgoKk739eaMA%3D%3D&position=7&pageNum=0&trk=public_jobs_jserp-result_search-card,not-found,"Who we are:BigID is an innovative tech startup that focuses on solutions for data security, compliance, privacy, and governance. We're leading the market in all things data: helping our customers reduce risk, drive business innovation, achieve compliance, build customer trust, make better decisions, and get more value from their data.We are building a global team with a passion for innovation and next-gen technology. BigID has been recognized for being one of CNBC’s Top 25 Startups powering the economy, we're on Built In's 2023 Best Places to Work, one of America's fastest-growing companies, Inc5000 2023, 3 years running, one of the 20 coolest identity access management and data protection companies, CRN Security 100 2023, a Market Leader in DSPM at the 11th annual Global InfoSec Awards (Cyber Defense Magazine) and 2023 Disruptor Gold Winner - Most Disruptive Cyber Security Software, Globee Awards.At BigID, our team is the foundation of our success. Join a people-centric culture that is fast-paced and rewarding: you’ll have the opportunity to work with some of the most talented people in the industry who value innovation, diversity, integrity, and collaboration.Who We Seek:Reporting to the Head of IT in Tel Aviv, IT Ops Engineers are responsible for cloud-based services and infrastructure and Infrastructure as Code, with a strong focus on automation and integration between services.What you’ll do:Be an active part of the global IT team. Share responsibilities and contribute to the success of the global IT unitParticipate in automation efforts across all parts of the IT operation, partnering with various leaders across the security team, R&D, the People team, and business unitsParticipate in the management of our SaaS back-office stack (Google Workspaces, Okta, Atlassian, Slack, Zoom, etc.)Identify and implement automation opportunities for IT processesBe part of the IaC effortsDiagnose and troubleshoot IT issues and come up with solutionsDiagnose and troubleshoot users and endpoint (Windows & MacOS) issues and come up with solutionsAccurately document and maintain our inventory of technology hardware, software, and resourcesEstablish, document, and implement processes and proceduresSkillfully manage relationships with vendors and contractors for all IT-related purposesUpdate and modify IT infrastructure to address scalability, repeatability, and securityMake sure security is foremost in everything you doWhat you’ll bring:2+ years of experience automating IT processes5+ years of experience as an IT expert supporting SaaS and backend services, preferably at a technology companyA cybersecurity mindset: think “security” in every processA customer experience mindset: excited to dig into any issue, big or small, provide empathy and action to support IT customersAn automation mindsetProficiency in DevOps tools and automation languages, such as Python, NodeJS, PHP, Terraform, and serverlessExperience with IaaS and IaCProficient in public cloud management: AWS, Azure, and GCPStrive to constantly improve anything and everything, identify issues, provide and implement solutionsAbility to identify weaknesses in processes, provide and implement solutionsA team player attitudeA Project Manager mindset: Independent and capable of leading processes and projectsExperience with API-driven processesHigh level of accuracy and attention to detailMature and responsible with confidential information as a natural part of this roleStrong communication and documentation skills (you love creating process docs)Strong analytical and problem solving skillsA very high level of EnglishWhat’s in it for you?!Our people are the foundation of our success, and we place a high priority on offering a wide range of benefits that make our team happier and healthier.Equity participation - everyone shares in our successFlexible work arrangementsOther compulsory benefits based on country of residenceOur Values:We look for people who embody our values - Care, Do,Try & Shine.Care - We care about our customers and each otherDo - We do what it takes to make a positive impactTry - We try our best and we don’t give upShine - We shine and make it our mission to always stand outBigDiversity:We’re committed to creating a culture of inclusion, diversity, and equality – across race, gender, sexuality, disability, and neurodiversity – where innovation and growth thrive, every voice is heard, and everybody belongs. Learn more about us here.CPRA Employee Privacy Notice: CABigID is an E-Verify Participant.Show moreShow less"
Senior Lead Product Manager,AutoLeap,https://ca.linkedin.com/jobs/view/senior-lead-product-manager-at-autoleap-3891672708?position=9&pageNum=0&refId=bzdYtCBZV7ramKKDf9k8KA%3D%3D&trackingId=L%2F5z97U%2B8s1SYWSWeVnQxg%3D%3D&trk=public_jobs_jserp-result_search-card,not-found,"About AutoLeapAutoLeap is the market-leading shop management SaaS provider in the underserved auto repair industry. The Shop Management System (SMS) provides an all-in-one, cloud-based auto repair management software that helps after-market auto shop owners focused on general repair to better understand, manage, and grow their business—from scheduling appointments to managing technicians and generating invoices to help save time and money.In 2023, we announced our $30m Series B led by Bain Capital, Threshold Ventures, and Advanced Venture Partners (AVP) and aren't slowing down. Our mission is to change the auto repair industry one shop at a time, helping shop owners get home to their families earlier and helping them build long-lasting healthy businesses to pass on to future generations. We will be the de facto choice for all shop owners looking to grow and improve their businesses with your help!Job DescriptionAs a Senior Lead Product Manager at AutoLeap, you will play a pivotal role in shaping the future of our product offerings within your designated domain. You will spearhead cross-functional Agile teams, closely collaborate with Auto Repair Shop Owners, and chart the course for your segment of the product. This is an opportunity for a seasoned professional to make a significant impact on the future of the automotive industry and contribute to a rapidly expanding, dynamic organization.As theSenior Lead Product Manager, you will own:Product Direction: Define and articulate the strategic direction for your product domain, ensuring alignment with overarching business objectives and addressing customer needs effectivelyStakeholder Collaboration: Engage extensively with Auto Repair Shop Owners to understand their pain points, solicit feedback, and advocate for their needs within the organizationCross-Functional Team Management: Lead and motivate cross-functional Agile teams, including developers, designers, and QA engineers, to deliver high-quality product increments within specified timelines and scopeRequirement Gathering and Prioritization: Collaborate closely with stakeholders to define, prioritize, and refine product requirements, ensuring comprehensive understanding and consensus to drive successful outcomesMarket Analysis: Stay abreast of industry trends, competitive dynamics, and emerging technologies to identify new opportunities and anticipate market shifts, enabling proactive decision-making and strategic planningUser Experience Enhancement: Champion user-centric design principles, collaborating with UX/UI designers to craft intuitive and delightful user experiences, iterating based on user feedbackMetrics-Driven Decision Making: Establish and monitor key product metrics, leveraging data analytics to derive actionable insights into user behavior and preferences, and using insights to drive informed product enhancements and optimizationsCommunication and Alignment: Effectively communicate product updates, milestones, and strategic direction to internal teams, stakeholders, and executive leadership, fostering transparency and alignment across the organizationContinuous Improvement: Foster a culture of innovation and efficiency for ongoing growth and excellence within the product organization.RequirementsMinimum 5 years of Product Management Experience: Proven track record leading customer-centric B2B SaaS productsProficiency in Agile Methodologies: Ability to lead Agile teams effectively in dynamic, high-pressure environments, ensuring timely delivery of quality productsExceptional Communication, Presentation, and Stakeholder Management Skills: Proven ability to influence and inspire cross-functional teamsEmpathetic User focus: A passion for solving their problems through innovative technology solutionsAnalytical Mindset and Data-Driven Decision-Making Skills: Ability to leverage data to drive informed decision-making and measure product successExperience in the Automotive Industry (Desirable): Experience or interest in the Automotive Industry is advantageousPlease note that this position requires a minimum of 20% travel.BenefitsComprehensive Health PlanRewards & RecognitionUnlimited PTOFull Tech StackGenerous Base SalaryGrowth opportunities to progress throughout the organization and an incredible culture!Show moreShow less"
Regional Sales Manager - Singapore,BigID,https://sg.linkedin.com/jobs/view/regional-sales-manager-singapore-at-bigid-3798545442?refId=Q8jJ8LRMvxbee%2BBIhmAHoA%3D%3D&trackingId=1qpx%2BwlxOTlaTVrUtivNdw%3D%3D&position=11&pageNum=0&trk=public_jobs_jserp-result_search-card,not-found,"Who we are:BigID is an innovative tech startup that focuses on solutions for data security, compliance, privacy, and governance. We're leading the market in all things data: helping our customers reduce risk, drive business innovation, achieve compliance, build customer trust, make better decisions, and get more value from their data.We are building a global team with a passion for innovation and next-gen technology. BigID has been recognized for being one of CNBC’s Top 25 Startups powering the economy, we're on Built In's 2023 Best Places to Work, one of America's fastest-growing companies, Inc5000 2023, 3 years running, one of the 20 coolest identity access management and data protection companies, CRN Security 100 2023, a Market Leader in DSPM at the 11th annual Global InfoSec Awards (Cyber Defense Magazine) and 2023 Disruptor Gold Winner - Most Disruptive Cyber Security Software, Globee Awards.At BigID, our team is the foundation of our success. Join a people-centric culture that is fast-paced and rewarding: you’ll have the opportunity to work with some of the most talented people in the industry who value innovation, diversity, integrity, and collaboration.Who we seek:We are looking for a Regional Sales Manager in Singapore who will be responsible for driving deals in the market. The ideal candidate will have experience selling enterprise data or security products and understand how to sell to complex technical audiences.What you’ll do:Identify, develop, and execute a comprehensive account strategy to close new business and drive expansion growth with customers across a defined territory.Prepare and maintain an accurate sales forecast for your territory.Network in customers and related organizations.Establish, access, and create positive business relationships with key executives and senior-level decision-makers.Maintain accurate and up-to-date account intelligence in Salesforce, including regular forecasting of business opportunities to sales and executive leadership.Report on sales activity and forecast to senior sales management.Responsible for territory quota and named accounts in a defined territory.Direct an inside sales team and marketing to uncover opportunities in territory.What you’ll bring:Excellent oral and written communication, able to articulate and present well in front of technical and executive level stakeholders.You will have 5-10+ years of direct sales experience selling enterprise software to mid-size to large enterprises.Proven track record of successfully closing six and seven figure software licensing deals with prospects and customers in the defined territory.You have a measurable track record in new business development and overachieving sales targets.Prior experience selling data security.Experience in selling complex enterprise software solutions and ability to adapt in fast-growing and changing environments.What’s in it for you?!Our people are the foundation of our success, and we prioritize offering a wide range of benefits that make our team happier and healthier.Equity participation - everyone shares in our successFlexible work arrangementsOther compulsory benefits based on country of residenceOur Values:We look for people who embody our values - Care, Do,Try & Shine.Care - We care about our customers and each otherDo - We do what it takes to make a positive impactTry - We try our best and we don’t give upShine - We shine and make it our mission to always stand outBigDiversity:We’re committed to creating a culture of inclusion, diversity, and equality – across race, gender, sexuality, disability, and neurodiversity – where innovation and growth thrive, every voice is heard, and everybody belongs. Learn more about us here.CPRA Employee Privacy Notice: CABigID is an E-Verify Participant.Show moreShow less"
