name,company,job_url,salary,description
Sales Development Representative,CivicPlus,https://www.linkedin.com/jobs/view/sales-development-representative-at-civicplus-3883752504?refId=IZzGiERLWkA6blFKxjBy%2Fg%3D%3D&trackingId=0BLf5vrYDPOUmS3o6ijDNQ%3D%3D&position=19&pageNum=0&trk=public_jobs_jserp-result_search-card,not-found,"If you are looking to break into tech sales or bring your sales experience to a home for long term growth, you have come to the right place! Whether you are a recent grad, changing careers or looking to expand your sales career, our team has a rich history of developing and building successful sales professionals.How do we do it? Every employee is unique, and our leadership team coaches you to build a solid fundamental foundation and empowers you to build on your strengths to find your sales voice. Our team is competitive and loves to challenge each other but is also collaborative and supportive by sharing best practices and working together as a team. If you want to spend your day with peers who are committed to succeed, hungry to be coached, and have the mental toughness to embrace the grind, then we want to talk to you.Our ideal candidate is an individual looking for a rapid growth path through our SDR ranks from SDRI to SDRIII in 12-18 months, while they learn our industry and business and earn a promotion to an Account Executive, Account Manager or Sales Engineer role. This is a remote role in the Dallas-Fort Worth area that will transition into a hybrid role (2-3 days/week) in the future.Responsibilities:Targeted outbound cold calling to government agencies to drive opportunities for the Account Executive teamManage a pipeline of target prospects and learn to analyze and diagnose KPIs to drive performance efficiencyConsistently achieve monthly qualified meeting quotaWhat’s a day like as an SDR with our Team?Each day you will make 50 outbound calls and 20 emails to target prospects for the products your team is focused on and book meetings for Account ExecutivesUnlike many sales organizations, we distribute the best accounts for you to target so you don’t have to waste time hunting and searching for places to callTons of opportunities to collaborate with your peers in morning huddles, call reviews, and team syncs1:1 weekly syncs with your manager and individual coaching sessionsWhat makes it exciting?Hear your teammates give you shoutouts for big wins in our Sales SyncBeat Mike in ping pong or Isaac in foosball in the Durham office, or win virtual SDR Team Bingo for a prizeGive virtual Tacos to your peers every day so they can buy cool swagChallenge yourself to earn various spiffs throughout the yearDrive yourself to be a top earner on our team with an uncapped commission structureJoin team lunch, happy hours and holiday eventsGet involved with one of our committees (DEIB, Great Workplace, Community Engagement, Wellness, Employee Resource Groups)Hybrid work schedule – get the best of both worldsSnacks and beverages provided in the officeCompensation and Benefits:Base Salary: $45,000 annually based on a full-time, 40-hour work weekPotential Variable Pay: $25,000 based on set goalsBenefits: Comprehensive health insurance, dental insurance, vision insurance, Flexible Time Off, 401(k) plan, and moreAbout CivicPlus:CivicPlus® is a trusted technology company dedicated to empowering government staff and powering exceptional digital experiences for residents. With a comprehensive suite of solutions that combine to form THE Modern Civic Experience Platform, we strive to create one-stop, frictionless, interactions that delight residents and help staff collaborate and work efficiently. As a result, government administrations that choose CivicPlus realize greater trust and satisfaction among their community members. Backed by over 25 years of experience and leveraging the insights of roughly 850 team members, our solutions are chosen by over 10,000 clients and are used daily by over 340 million people in the U.S. and Canada alone.PLEASE NOTE:CivicPlus is unable to sponsor visas at this time. You must be a US Citizen or Permanent Resident authorized to work in the US.All applicants will be subject to a background and reference check.Equal OpportunitiesCivicPlus is an equal opportunity employer and value diversity at our company. We desire to have our employees reflect the diverse communities we serve and we recognize that diverse and inclusive teams lead to more innovation and better financial returns. We do not discriminate on the basis of race, religion, color, national origin, gender, sexual orientation, age, marital status, veteran status, or disability status.Please be aware of scammers who may fraudulently allege to be from CivicPlus. These types of fraud can be carried out through copycat websites, fake email addresses claiming to be from our company, or social media. We do not ask for your personal information such as bank account numbers, identification numbers, etc through social media or chat-based apps, nor do we request or send money for the purchase of business equipment or request interviews via text message. If you suspect fraud, please report it to your local authorities, as well as reaching out to us at Recruiting@civicplus.com with any information you may have.Show moreShow less"
Sales Development Representative,CivicPlus,https://www.linkedin.com/jobs/view/sales-development-representative-at-civicplus-3833819194?refId=IZzGiERLWkA6blFKxjBy%2Fg%3D%3D&trackingId=wW5911O91aAJOvX7EB3grQ%3D%3D&position=20&pageNum=0&trk=public_jobs_jserp-result_search-card,"$25,000.00/yr - $45,000.00/yr","DescriptionIf you are looking to break into tech sales or bring your sales experience to a home for long term growth, you have come to the right place! Whether you are a recent grad, changing careers or looking to expand your sales career, our team has a rich history of developing and building successful sales professionals.How do we do it? Every employee is unique, and our leadership team coaches you to build a solid fundamental foundation and empowers you to build on your strengths to find your sales voice. Our team is competitive and loves to challenge each other but is also collaborative and supportive by sharing best practices and working together as a team. If you want to spend your day with peers who are committed to succeed, hungry to be coached, and have the mental toughness to embrace the grind, then we want to talk to you.Our ideal candidate is an individual looking for a rapid growth path through our SDR ranks from SDRI to SDRIII in 12-18 months, while they learn our industry and business and earn a promotion to an Account Executive, Account Manager or Sales Engineer role. This is a hybrid position, which involves working from our Durham, NC; Manhattan, KS; or Dallas-Fort Worth office location 2 to 3 days a week.ResponsibilitiesTargeted outbound cold calling to government agencies to drive opportunities for the Account Executive teamManage a pipeline of target prospects and learn to analyze and diagnose KPIs to drive performance efficiencyConsistently achieve monthly qualified meeting quotaWhat’s a day like as an SDR with our Team?Each day you will make 50 outbound calls and 20 emails to target prospects for the products your team is focused on and book meetings for Account ExecutivesUnlike many sales organizations, we distribute the best accounts for you to target so you don’t have to waste time hunting and searching for places to callTons of opportunities to collaborate with your peers in morning huddles, call reviews, and team syncs1:1 weekly syncs with your manager and individual coaching sessionsWhat makes it exciting?Hear your teammates give you shoutouts for big wins in our Sales SyncBeat Mike in ping pong or Isaac in foosball in the Durham office, or win virtual SDR Team Bingo for a prizeGive virtual Tacos to your peers every day so they can buy cool swagChallenge yourself to earn various spiffs throughout the yearDrive yourself to be a top earner on our team with an uncapped commission structureJoin team lunch, happy hours and holiday eventsGet involved with one of our committees (DEIB, Great Workplace, Community Engagement, Wellness, Employee Resource Groups)Hybrid work schedule – get the best of both worldsSnacks and beverages provided in the officeCompensation And BenefitsBase Salary: $45,000 annually based on a full-time, 40-hour work weekPotential Variable Pay: $25,000 based on set goalsBenefits: Comprehensive health insurance, dental insurance, vision insurance, Flexible Time Off, 401(k) plan, and moreAboutAbout CivicPlus:CivicPlus® is a trusted technology company dedicated to empowering government staff and powering exceptional digital experiences for residents. With a comprehensive suite of solutions that combine to form THE Modern Civic Experience Platform, we strive to create one-stop, frictionless, interactions that delight residents and help staff collaborate and work efficiently. As a result, government administrations that choose CivicPlus realize greater trust and satisfaction among their community members. Backed by over 25 years of experience and leveraging the insights of roughly 850 team members, our solutions are chosen by over 10,000 clients and are used daily by over 340 million people in the U.S. and Canada alone.PLEASE NOTE:CivicPlus is unable to sponsor visas at this time. You must be a US Citizen or Permanent Resident authorized to work in the US.All applicants will be subject to a background and reference check.Equal OpportunitiesCivicPlus is an equal opportunity employer and value diversity at our company. We desire to have our employees reflect the diverse communities we serve and we recognize that diverse and inclusive teams lead to more innovation and better financial returns. We do not discriminate on the basis of race, religion, color, national origin, gender, sexual orientation, age, marital status, veteran status, or disability status.Please be aware of scammers who may fraudulently allege to be from CivicPlus. These types of fraud can be carried out through copycat websites, fake email addresses claiming to be from our company, or social media. We do not ask for your personal information such as bank account numbers, identification numbers, etc through social media or chat-based apps, nor do we request or send money for the purchase of business equipment or request interviews via text message. If you suspect fraud, please report it to your local authorities, as well as reaching out to us at [email protected] with any information you may have.Show moreShow less"
Analyst Relations Manager,BigID,https://www.linkedin.com/jobs/view/analyst-relations-manager-at-bigid-3908123117?refId=Q8jJ8LRMvxbee%2BBIhmAHoA%3D%3D&trackingId=3un6jWaRrGgzMsuy7p9TlA%3D%3D&position=1&pageNum=0&trk=public_jobs_jserp-result_search-card,"$115,000.00/yr - $135,000.00/yr","Who we are:BigID is an innovative tech startup that focuses on solutions for data security, compliance, privacy, and governance. We're leading the market in all things data: helping our customers reduce risk, drive business innovation, achieve compliance, build customer trust, make better decisions, and get more value from their data.We are building a global team with a passion for innovation and next-gen technology. BigID has been recognized for being one of CNBC’s Top 25 Startups powering the economy, we're on Built In's 2023 Best Places to Work, one of America's fastest-growing companies, Inc5000 2023, 3 years running, one of the 20 coolest identity access management and data protection companies, CRN Security 100 2023, a Market Leader in DSPM at the 11th annual Global InfoSec Awards (Cyber Defense Magazine) and 2023 Disruptor Gold Winner - Most Disruptive Cyber Security Software, Globee Awards.At BigID, our team is the foundation of our success. Join a people-centric culture that is fast-paced and rewarding: you’ll have the opportunity to work with some of the most talented people in the industry who value innovation, diversity, integrity, and collaboration.Who we seek:As BigID’s Analyst Relations Manager, you’ll build relationships with top industry analyst firms like Gartner, Forrester, IDC, and others while promoting BigID across security, data management, privacy, risk, and AI markets. You'll work with our Product Marketing and Product teams to deepen analyst relationships, build mind share, create research-derived content, and bring valued insights to accelerate our go-to-market execution.At BigID, you’ll be part of a fast-paced, high-growth startup: thinking big and small, with a significant opportunity to help us grow the business, raise the profile of BigID across top industry analysts, and showcase our innovation in product and technology.What you’ll do:Scheduling, preparing, and conducting inquiries and briefings with relevant research analysts and stakeholders.Proactively following up with inquiries, ensuring timely responses and delivery of necessary correspondence and reference materials.Maintaining an active AR calendar with upcoming meetings, research deadlines, and key analyst reports.Monitoring analyst sentiment and upcoming research agendas to identify new engagement opportunities.Ensure that BigID is top-of-mind for key industry and analyst reports, and is well represented in analyst reports and published research (including Forrester Waves™, Gartner Magic Quadrants, IDC Marketscapes), blogs, press releases, and commissioned research.Work closely with product and marketing teams to craft analyst-specific positioning, messaging, and narratives that result in favorable analyst perceptions.Monitor analyst research agendas and coverage, share relevant research, and educate internal audiences about key analyst reports/evaluations.Tracking competitor coverage by analysts and helping influence and develop strategies to improve BigID's positioning.What you’ll bring:An entrepreneurial individual with a background and proven success in developing high-impact relationships with analysts and other industry influencers.Experience in enterprise B2B SaaS organizations and building relationships with top-tier analysts and other industry influencers.Passion for industry-leading tech that’s changing the world, across data security, compliance, AI, governance, security, and privacy.Comfortable with technology concepts and a general knowledge of the customer engagement space.Flexible with the ability to think/act strategically - and work as an individual contributor to deliver results for the business.Ability to communicate clear, concise, and actionable insights on industry trends, analyst sentiment, and other findings to executive leadership.Our Values:We look for people who embody our values - Care, Do, Try & Shine.Care - We care about our customers and each otherDo - We do what it takes to make a positive impactTry - We try our best and we don’t give upShine - We shine and make it our mission to always stand outThe annual base salary range is $115,000 – $135,000. Actual salaries will vary and are based on a candidate’s qualifications, skills, and competencies. Salary is just one component of our Compensation Philosophy. Variable/Bonus Compensation & Equity Incentives align with individual and company performance.BigBenefits:💻 Work from home with a global remote-first communityGlobal Culture CornerFlexible PTO and Quarterly Volunteer Days💸 Equity Participation100% employer-covered medical, dental, and vision options available to you🐶 Additional insurance benefits like pet insurance and legal assistance📚 Learning & Development OpportunitiesFidelity Employer Sponsored 401KRobust DEI Program with several vibrant ERG communitiesPaid Parental LeaveBigDiversity:We’re committed to creating a culture of inclusion, diversity, and equality – across race, gender, sexuality, disability, and neurodiversity – where innovation and growth thrive, every voice is heard, and everybody belongs. Learn more about us here.CPRA Employee Privacy Notice: CABigID is an E-Verify Participant.Show moreShow less"
Talent Network - Didn't See the Role You Were Looking for? Apply Here!,BigID,https://www.linkedin.com/jobs/view/talent-network-didn-t-see-the-role-you-were-looking-for%3F-apply-here%21-at-bigid-3844472287?refId=Q8jJ8LRMvxbee%2BBIhmAHoA%3D%3D&trackingId=gV14%2BIfMg6xhGakh8bO3sA%3D%3D&position=4&pageNum=0&trk=public_jobs_jserp-result_search-card,not-found,"Who we are:BigID is an innovative tech startup that focuses on solutions for data security, compliance, privacy, and governance. We're leading the market in all things data: helping our customers reduce risk, drive business innovation, achieve compliance, build customer trust, make better decisions, and get more value from their data.We are building a global team with a passion for innovation and next-gen technology. BigID has been recognized for being one of CNBC’s Top 25 Startups powering the economy, we're on Built In's 2023 Best Places to Work, one of America's fastest-growing companies, Inc5000 2023, 3 years running, one of the 20 coolest identity access management and data protection companies, CRN Security 100 2023, a Market Leader in DSPM at the 11th annual Global InfoSec Awards (Cyber Defense Magazine) and 2023 Disruptor Gold Winner - Most Disruptive Cyber Security Software, Globee Awards.At BigID, our team is the foundation of our success. Join a people-centric culture that is fast-paced and rewarding: you’ll have the opportunity to work with some of the most talented people in the industry who value innovation, diversity, integrity, and collaboration.About You:Are you interested in BigID but haven't quite seen the job posting that fits you? Then tell us how you would fit! Let us know your story and your job description and what your impact on BigID would be.What’s in it for you?!Our people are the foundation of our success, and we place a high priority on offering a wide range of benefits that make our team happier and healthier.Equity participation - everyone shares in our successFlexible work arrangementsOther compulsory benefits based on country of residenceOur Values:We look for people who embody our values - Care, Do,Try & Shine.Care - We care about our customers and each otherDo - We do what it takes to make a positive impactTry - We try our best and we don’t give upShine - We shine and make it our mission to always stand outActual salaries will vary and are based on a candidate’s qualifications, skills, and competencies. Salary is just one component of our Compensation Philosophy. Variable/Bonus Compensation & Equity Incentives align with individual and company performance.BigDiversity:We’re committed to creating a culture of inclusion, diversity, and equality – across race, gender, sexuality, disability, and neurodiversity – where innovation and growth thrive, every voice is heard, and everybody belongs. Learn more about us here.CPRA Employee Privacy Notice: CABigID is an E-Verify Participant.Show moreShow less"
Proposal Specialist,BigID,https://www.linkedin.com/jobs/view/proposal-specialist-at-bigid-3901856565?refId=Q8jJ8LRMvxbee%2BBIhmAHoA%3D%3D&trackingId=8XGhCVWi9ORY5clSpKiI5Q%3D%3D&position=5&pageNum=0&trk=public_jobs_jserp-result_search-card,"$80,000.00/yr - $105,000.00/yr","Who we are:BigID is an innovative tech startup that focuses on solutions for data security, compliance, privacy, and governance. We're leading the market in all things data: helping our customers reduce risk, drive business innovation, achieve compliance, build customer trust, make better decisions, and get more value from their data.We are building a global team with a passion for innovation and next-gen technology. BigID has been recognized for being one of CNBC’s Top 25 Startups powering the economy, we're on Built In's 2023 Best Places to Work, one of America's fastest-growing companies, Inc5000 2023, 3 years running, one of the 20 coolest identity access management and data protection companies, CRN Security 100 2023, a Market Leader in DSPM at the 11th annual Global InfoSec Awards (Cyber Defense Magazine) and 2023 Disruptor Gold Winner - Most Disruptive Cyber Security Software, Globee Awards.At BigID, our team is the foundation of our success. Join a people-centric culture that is fast-paced and rewarding: you’ll have the opportunity to work with some of the most talented people in the industry who value innovation, diversity, integrity, and collaboration.Who we seek:We’re looking for a Proposal Specialist/Manager for our Global Business Operations (GBO) team, reporting to the Proposal Director. Our GBO team is a global team based across the US and Europe, tasked with ensuring efficient and successful operations across the organization. As a Proposal Specialist, you will be responsible for the completion of compliant, value-driven proposals, maintaining our content library and reporting on win/loss data. Our ideal candidate is someone who has hands-on proposal management experience and can collaborate cross-functionally while adhering to process.What you’ll do:Kickoff new projects in Responsive (our proposal management tool) - upload/configure documents & assign tasks to broader teamAssist SEs/Sales org with project creation and closeout process, as necessary; make sure projects are being documented and saved according to our processContent library cleanup (archiving old responses, adding tagging, owners, preferred answers, etc.) and upkeep of the toolServe as the internal POC for ResponsiveAnalyze RFP requirements and ensure that proposals are compliantEdit and rewrite proposals, including creating templates and boilerplate textAssist with project schedules - create, manage, ensure timelines for completionCapture win/loss data & translate into quarterly reportsData gathering for tracking, reporting salesforce dashboards with current proposal statisticsDraft proposals and communicate across teams to get input and meet deadlinesAssist in various other tasks to support productivity and scalability of proposal teamWhat you’ll bring:3+ years experience in the proposal fieldExperience in end to end proposal developmentExcellent time management & organizational skills with the ability to multitask in a fast-paced startup environment (juggle multiple proposals at once without compromising work quality)Familiarity with proposal management and automation industry tools (Responsive, Loopio, Qvidian, Ombud, etc.)Experience creating response outlines, templates, etc.Collaborative mindset & comfortable interacting with all levels of the organization + enforcing deadlinesGo-getter mentalityOur Values:We look for people who embody our values - Care, Do, Try & Shine.Care - We care about our customers and each otherDo - We do what it takes to make a positive impactTry - We try our best and we don’t give upShine - We shine and make it our mission always to stand outThe annual base salary range is $80,000 – $105,000. Actual salaries will vary and are based on a candidate’s qualifications, skills, and competencies. Salary is just one component of our Compensation Philosophy. Variable/Bonus Compensation & Equity Incentives align with individual and company performance.BigBenefits:💻 Work from home with a global remote-first community🏆 Global Culture Corner🏝️ Flexible PTO and Quarterly Volunteer Days💸 Equity Participation🏥 100% employer-covered medical, dental, and vision options available to you🐶 Additional insurance benefits like pet insurance and legal assistance📚 Learning & Development Opportunities💰 Fidelity Employer Sponsored 401K📣 Robust DEI Program with several vibrant ERG communities🍼 Paid Parental LeaveBigDiversity:We’re committed to creating a culture of inclusion, diversity, and equality – across race, gender, sexuality, disability, and neurodiversity – where innovation and growth thrive, every voice is heard, and everybody belongs. Learn more about us here.CPRA Employee Privacy Notice: CABigID is an E-Verify Participant.Show moreShow less"
