name,company,job_url,salary,description
Middle Market Account Executive,Slang.ai,https://www.linkedin.com/jobs/view/middle-market-account-executive-at-slang-ai-3849939178?position=4&pageNum=0&refId=u%2FTqhDR1y%2FYtBVtC3iEUfw%3D%3D&trackingId=G7wgGEPzc2lfqo%2FuzVqR0Q%3D%3D&trk=public_jobs_jserp-result_search-card,"$85,000.00/yr - $100,000.00/yr","Slang is at an exciting inflection point — we are building a world-class GTM function and need an experienced Account Executive to establish our Middle Market sales processes. As an early sales hire at Slang, you'll work directly with the VP of Sales. This role is crucial to the company's success during a time of rapid sales growth.You will be responsible for finding and closing middle market deals that fuel Slang’s growth. Likewise, you should expect to collaboratively improve the sales processes for large accounts with marketing on ABM prospecting, the Director of Account Management on pilot and expansion processes, and the VP of Sales on pitch refinement, sales stages and forecasting, negotiations, and pipeline review processes. A strong operational process orientation, impeccable ability to partner with an account management counterpart, exceptional multi-threading ability, and the ability to build lasting customer relationships are also very important for the success of this role.You'd be a great fit for this role if you have a strong track record of high performance in an early-stage SaaS company selling to large (20-200 location) restaurant groups.ResponsibilitiesDeliver New Business Quota: Prospect, demo and close revenue to exceed company targets for the middle market customer segment (21+ location restaurant groups). Travel to conferences and onsite customer meetingsEnd-to-End Sales Process Execution: Leverage customer success metrics and feedback to identify trends, share customer insights, and drive product and service enhancements. Drive improvement around key performance indicators including churn, time to value, expansion revenue, net revenue retention, CSAT/NPS, average sale price and close rate of expansion opportunities, and other retention, expansion and support-based performance metricsForecasting: Maintain updated and accurate notes and forecasting stages for all open opportunities resulting in high accuracy forecastCross-Functional Collaboration: Collaborate with all business functions to deliver company initiativesQualifications2-5+ years of Middle Market restaurant sales experience ($50K-$500K average contract value deal sizes with average sales cycles from 30-180 days)A track record of achieving revenue growth targetsStrong problem-solving skills, and the ability to think creatively and strategicallyExperience evangelizing new use cases for prospects, champion selling, and multi-threading to achieve alignment through multiple stakeholdersExperience working with procurement, legal, and finance departments to meet closing deadlines for the customerExceptional communication and writing skills - you can adjust your style to the audience and communicate clearly, concisely and positivelyBonusExperience selling reservation management or point-of-sale software to full-service restaurantsExperience selling a category-leading product that is in a new technology to your ICPMEDDICC experienceEarly stage SaaS experienceHaving a rolodex of customers you can bring with youBenefitsCompetitive payGenerous equityHealthcare fully compensatedGenerous vacationOur VisionCalling a business shouldn’t feel like a robot-hostage situation, where you’re forced to listen to horrible music and can't reach a human, while enduring a soulless voice uttering ""I'm sorry I didn't quite get that"" on repeat for eternity. (shudder) That’s why we started Slang.ai. We use the latest AI and audio wizardry to make transacting via voice so enjoyable it’s more human than human. By 2030, we will save businesses and consumers 1 billion minutes of precious time while transforming voice channels into the preferred mode of communication (it's faster and easier than text).We have backgrounds building product at companies like Spotify, Buzzfeed, the New York Times, and OpenTable —shipping experiences that have reached hundreds of millions of users. Now, we’re using our backgrounds to start a new culture, one that puts product and human-centered design above all else while fostering constant learning and growth. Sound like something you’d like to be part of? Get on board.Our ValuesOverachiever Fever. We’re overachievers (we don’t know any other way)Learner Fervor. We take every opportunity to learn (especially when it’s hard)Humility Ability. We approach each other with curiosity and openness (know-it-alls not welcome!)SMB MVP. We’re an expert member of our customers’ teams (we earn their trust)OTE of $170k-$200k/yearGenerous EquityShow moreShow less"
Senior Back End Engineer,Slang.ai,https://www.linkedin.com/jobs/view/senior-back-end-engineer-at-slang-ai-3493096947?position=5&pageNum=0&refId=u%2FTqhDR1y%2FYtBVtC3iEUfw%3D%3D&trackingId=a2IrCJbb200MOVxdGRdntg%3D%3D&trk=public_jobs_jserp-result_search-card,"$150,000.00/yr - $180,000.00/yr","As an early engineer at Slang, you will work closely with the CEO and CTO on projects that drive our success. High impact is a trope in tech, but it's definitely true here. Everything you build will touch our existing and incoming customers and propel sales into the stratosphere. If you enjoy feeling the direct impact of your work on users, as opposed to the faceless masses (which is cool too we're former big tech ppl so not judging), this might be your ticket to the moon. You will touch our existing full-stack kotlin MPP application, our backend systems that handle the voice/ai heavy-lifting and new things we haven't even thought of yet (well, yes there's a roadmap too).Qualifications6+ years of experience in a professional software engineering setting building production quality applicationsFacility with static typing — type systems with generics are a huge +Familiarity with hybrid functional/OOP programmingAt least a little experience with Java (don't need to be an expert but Java comes up in libraries we use and kotlin is JVM after all)SQL/NoSQL are NBD for youExpertise in AWS/GCP/Azure (we are on GCP)Strong grasp of microservices and stateless application paradigms in cloud computing environmentsLaughs in distributed systemsFluent in SOLID principles/DDD/Clean ArchitectureDreams in SRE always considering SLO(A)sBonus PointsKotlin/ScalaML/AI systems and infrastructureEnough Kubernetes to know the pain points(This one is a super not necessary, but hey, we can dream) Advanced degree with a focus in NLPBenefitsCompetitive pay, generous equity, healthcare fully comped, generous vacation, conference and education reimbursement, and career coaching (if you want it!) .We're also always listening to our employees to find the perks they would like most so we're open to your ideas! Oh, also, super fun off-sites (pandemic permitting). We invest in the best software tooling cause we care about your ergonomics. Everyone gets Intellij Ultimate for example...Our VisionCalling a business shouldn’t feel like a robot-hostage situation, where you’re forced to listen to horrible music and can't reach a human, while enduring a soulless voice uttering ""I'm sorry I didn't quite get that"" on repeat for eternity. (shudder) That’s why we started Slang.ai. We use the latest AI and audio wizardry to make transacting via voice so enjoyable it’s more human than human. By 2030, we will save businesses and consumers 1 billion minutes of precious time while transforming voice channels into the preferred mode of communication (it's faster and easier than text).We have backgrounds building product at companies like Spotify, Buzzfeed, the New York Times, and OpenTable—shipping experiences that have reached hundreds of millions of users. Now, we’re using our backgrounds to start a new culture, one that puts product and human-centered design above all else while fostering constant learning and growth. Sound like something you’d like to be part of? Get on board.Our ValuesBuild for better. If it doesn't make life better, we don't build it. We're obsessed with the experience of not just our end-users and their customers, but also our employees and anyone affected by what we create.Collaborate playfully. You won't find any downers here. We don’t have a tiny violin. We're all on the same team, and we act like it. We support each other, joke around (appropriately), and keep our egos in low orbit. We dance when the music isn't playing and invite others to join.Keep growing. Growth requires an environment that encourages it and people who crave it. We lay the groundwork for both. By welcoming diverse perspectives that challenge our own thinking, we can amplify our individual and collective potential.Give a sh*t. Everyone is an owner. We dive into any problem head-first and keep ourselves and others accountable. Why? Because we care about doing right by our end users, our customers, and all other stakeholders.Make lightspeed look good. Moving fast allows us to better serve our customers and outrun the competition. Sometimes we drop the baton, but instead of getting upset about it, we learn and adapt. And even as we rocket ahead, we don’t sacrifice quality or settle for crappy code or poor design.BenefitsCompetitive payGenerous equityHealthcare fully compensatedGenerous vacationOur VisionCalling a business shouldn’t feel like a robot-hostage situation, where you’re forced to listen to horrible music and can't reach a human, while enduring a soulless voice uttering ""I'm sorry I didn't quite get that"" on repeat for eternity. (shudder) That’s why we started Slang.ai. We use the latest AI and audio wizardry to make transacting via voice so enjoyable it’s more human than human. By 2030, we will save businesses and consumers 1 billion minutes of precious time while transforming voice channels into the preferred mode of communication (it's faster and easier than text).We have backgrounds building product at companies like Spotify, Buzzfeed, the New York Times, and OpenTable —shipping experiences that have reached hundreds of millions of users. Now, we’re using our backgrounds to start a new culture, one that puts product and human-centered design above all else while fostering constant learning and growth. Sound like something you’d like to be part of? Get on board.Our ValuesOverachiever Fever. We’re overachievers (we don’t know any other way)Learner Fervor. We take every opportunity to learn (especially when it’s hard)Humility Ability. We approach each other with curiosity and openness (know-it-alls not welcome!)SMB MVP. We’re an expert member of our customers’ teams (we earn their trust)Base salary.Show moreShow less"
Account Executive,Slang.ai,https://www.linkedin.com/jobs/view/account-executive-at-slang-ai-3642126066?position=6&pageNum=0&refId=u%2FTqhDR1y%2FYtBVtC3iEUfw%3D%3D&trackingId=K%2BOwQps6a0i4N6%2BwPAOA6g%3D%3D&trk=public_jobs_jserp-result_search-card,"$55,000.00/yr - $85,000.00/yr","We're hiring an Account Executive to help scale the business to the next level. As an early sales hire at the Slang, you'll work directly with the CEO and VP of Sales. This role is crucial to the success of the company during a time of rapid growth.ResponsibilitiesHunt and closeUse active listening for discovery and demoDiscuss how Slang best meets our prospects' needsGrow existing and new verticalsStrategically manage your pipeline to ensure consistent deal flowWork closely with the Onboarding and Account Management teams to support onboardingAchieve and exceed quarterly sales quotas and weekly top of funnel metricsQualifications3+ years of sales experience with proven track record of overachievingYou and other people would describe you as a hunter, closer, clever, charming, and kindYou can hustle, want to change your stars, and you don't wait to do what can be done nowYou're excited to work in a fast-paced startup environment and thrive under pressureYou are coachable, self-motivated, and think outside the boxYou have strong communication skills, both written and over the phoneYou're a good listener, assertive, persistent and persuasiveSaaS, Hospitality, Ecommerce experience preferredBenefitsCompetitive payGenerous equityHealthcare fully compensatedGenerous vacationOur VisionCalling a business shouldn’t feel like a robot-hostage situation, where you’re forced to listen to horrible music and can't reach a human, while enduring a soulless voice uttering ""I'm sorry I didn't quite get that"" on repeat for eternity. (shudder) That’s why we started Slang.ai. We use the latest AI and audio wizardry to make transacting via voice so enjoyable it’s more human than human. By 2030, we will save businesses and consumers 1 billion minutes of precious time while transforming voice channels into the preferred mode of communication (it's faster and easier than text).We have backgrounds building product at companies like Spotify, Buzzfeed, the New York Times, and OpenTable —shipping experiences that have reached hundreds of millions of users. Now, we’re using our backgrounds to start a new culture, one that puts product and human-centered design above all else while fostering constant learning and growth. Sound like something you’d like to be part of? Get on board.Our ValuesOverachiever Fever. We’re overachievers (we don’t know any other way)Learner Fervor. We take every opportunity to learn (especially when it’s hard)Humility Ability. We approach each other with curiosity and openness (know-it-alls not welcome!)SMB MVP. We’re an expert member of our customers’ teams (we earn their trust)Base salary. OTE will also be a component for the Account Executive role.Show moreShow less"
Senior Full Stack Engineer,Slang.ai,https://www.linkedin.com/jobs/view/senior-full-stack-engineer-at-slang-ai-3450871674?position=8&pageNum=0&refId=u%2FTqhDR1y%2FYtBVtC3iEUfw%3D%3D&trackingId=VgkRNWOoNh4o9jvbYM3elw%3D%3D&trk=public_jobs_jserp-result_search-card,"$150,000.00/yr - $180,000.00/yr","As an early engineer at Slang, you will work closely with the CEO and CTO on projects that drive our success. High impact is a trope in tech, but it's definitely true here. Everything you build will touch our existing and incoming customers and propel sales into the stratosphere. If you enjoy feeling the direct impact of your work on users, as opposed to the faceless masses (which is cool too we're former big tech ppl so not judging), this might be your ticket to the moon. You will touch our existing full-stack Kotlin MPP application, our backend systems that handle the voice/ai heavy-lifting and new things we haven't even thought of yet (well, yes there's a roadmap too).Qualifications6+ years of experience in a professional software engineering setting building production quality applicationsFacility with static typing — type systems with generics are a huge +Familiarity with hybrid functional/OOP programmingAt least a little experience with Java (don't need to be an expert but Java comes up in libraries we use and kotlin is JVM after all)SQL/NoSQL are NBD for youReact or similar toolingExpertise in AWS/GCP/Azure (we are on GCP)Strong grasp of microservices and stateless application paradigms in cloud computing environmentsLaughs in distributed systemsBonus PointsKotlin/ScalaML/AI systems and infrastructureEnough Kubernetes to know the pain points(This one is a super not necessary, but hey, we can dream) Advanced degree with a focus in NLPBenefitsCompetitive payGenerous equityHealthcare fully compensatedGenerous vacationOur VisionCalling a business shouldn’t feel like a robot-hostage situation, where you’re forced to listen to horrible music and can't reach a human, while enduring a soulless voice uttering ""I'm sorry I didn't quite get that"" on repeat for eternity. (shudder) That’s why we started Slang.ai. We use the latest AI and audio wizardry to make transacting via voice so enjoyable it’s more human than human. By 2030, we will save businesses and consumers 1 billion minutes of precious time while transforming voice channels into the preferred mode of communication (it's faster and easier than text).We have backgrounds building product at companies like Spotify, Buzzfeed, the New York Times, and OpenTable —shipping experiences that have reached hundreds of millions of users. Now, we’re using our backgrounds to start a new culture, one that puts product and human-centered design above all else while fostering constant learning and growth. Sound like something you’d like to be part of? Get on board.Our ValuesOverachiever Fever. We’re overachievers (we don’t know any other way)Learner Fervor. We take every opportunity to learn (especially when it’s hard)Humility Ability. We approach each other with curiosity and openness (know-it-alls not welcome!)SMB MVP. We’re an expert member of our customers’ teams (we earn their trust)Base salary.Show moreShow less"
Software Engineer Intern,Stealth,https://www.linkedin.com/jobs/view/software-engineer-intern-at-stealth-3907440934?refId=HAfhANVRO1B3klBBR45yrw%3D%3D&trackingId=ik01nI9fTFFR%2BOLJgmpT0w%3D%3D&position=1&pageNum=0&trk=public_jobs_jserp-result_search-card,"$100,000.00/yr - $150,000.00/yr","Software Engineer InternFully Remote$100k-150kPermanentAre you looking for an exciting next challenge in your Web3 or AI career?Perhaps this role at the intersection of the two is for you!The rolePrototype rapidly, iterate and execute quickly based on technical guidanceWork at the frontier of modern cryptographic schemes and open-source AIRelease your work into the open-source world and build alongside the Ritual communityAbout youIntellectually curious around intersections of interdisciplinary fields ranging from game theory to cryptography to machine learningQuick iteration and development cycles on writing and/or proof-of-conceptFor the entire scoop on this super opportunity, please apply and we give you the DL!Show moreShow less"
Data Entry Specialist [28290],Stealth,https://www.linkedin.com/jobs/view/data-entry-specialist-28290-at-stealth-3904648596?refId=HAfhANVRO1B3klBBR45yrw%3D%3D&trackingId=Okrxf6N8iQJhqdeZ622jiQ%3D%3D&position=2&pageNum=0&trk=public_jobs_jserp-result_search-card,$18.00/hr - $23.00/hr,"Our StoryOur core focus is to provide our customers with an exceptional experience across all departments of our company. To give them a high quality, technically exact, on-time precision product backed by a highly personalized customer journey. Our divisions include Fluid Power, Advanced Manufacturing and Finished Metal Alloy supply. Our products include hydraulic components, stainless instrumentation, industrial PVF, machined components and finished metals. Over the last 11 years since our founding, we have built a powerful brand across the B2B-Industrial market across America. We have grown 20-25% a year since our founding and are now approved suppliers for organizations such as John Deere, Toyota, NASA, SpaceX, US Department of Defense, and thousands of other clients across enterprise and SMB markets.Our Core ValuesSolution-Oriented: We are problem solvers, committed to finding solutions via our process and products.Passionate: We care deeply about our customers’ experience and our company’s performance.Knowledge-Driven: We strive to learn new things to better serve our customers and co-workers.Diligent: We resolve all issues to completion and get the job done right every time.Accountable: We take ownership of every challenge and assume full responsibility to reach success.Why you'll love it hereCompetitive Salary $18.00-$23.00 an hour.Paid vacation and sick leave.Countless opportunities to grow and learn new skills.Benefits, including health, dental and vision insurance, and a matching 401k Retirement Plan…and so much more!How You'll Make an ImpactPrepares, compiles, and prioritizes documents for data entry.Verifies and logs receipt of data.Transcribes source data into the required electronic format.Transfers information from paper formats into computer files using keyboards, data recorders, or optical scanners.Performs high-volume data entry using word processing, spreadsheet, database, or other computer software.Verifies integrity of data by comparing it to source documents.Reviews data for errors, missing pages, or missing information and resolves and discrepancies.Maintains a filing system and protects confidential customer information.Performs regular backups to ensure data preservation.Responds to requests to retrieve data from the database or electronic filing system.Uses basic office equipment (photocopy machine, printer, scanner, etc.)Maintains a satisfactory level of quality and productivity per department standards.Performs other related duties as assigned.Who we are looking forHigh School diploma or GED certificateAssociate degree preferred but not required.1-3 years of experience in data entry or equivalent trainingCRM experience preferred but not required.Proficient in Microsoft Office Suite, Microsoft Excel, Microsoft Word, Google Docs and Google SheetsExcellent attention to detailAbility to multitask effectively.Excellent verbal and written communication skills.Ability to perform repetitive tasks with a high degree of accuracy.Comfortable working independently with minimal supervisionShow moreShow less"
Sourcer/HR Assistant/Recruiting Coordinator - Entry Level,Stealth,https://www.linkedin.com/jobs/view/sourcer-hr-assistant-recruiting-coordinator-entry-level-at-stealth-3907987622?refId=HAfhANVRO1B3klBBR45yrw%3D%3D&trackingId=3FZ9gai%2BN30EQQBpS0dAjw%3D%3D&position=3&pageNum=0&trk=public_jobs_jserp-result_search-card,"$45,000.00/yr - $47,000.00/yr","Full Job DescriptionEntry Level Sourcer/Recruiting Coordinator - Entry levelWe are a small startup and looking for someone to help out and take over lots of different tasks:Schedule interviews 35+% of the time in both lever and greenhouseSource Technical & Non Technical rolesWork hand and hand with hiring managersHand hold and keep track of candidates over a long amount of time.posting jobsGet stuff done attitudebasic invoicing clients/billing and other paperwork is taken care ofHelping schedule of events/off sitesQualificationsCPA or advanced accounting degree or experience with payroll, invoicing and billing1+ years of accounting, EA or Office management experience, or college degreeFamiliar with HR or Recruiting a PlusStrong organizational skillsWe are looking for someone for the long term, who is comfortable taking charge overseeing, managing, growing, and maintaining a complex businessAttention to detail is a Must!Responsibilities•Helping schedule interviews/exploratory calls via Lever or Greenhouse for numerous different companies•When problems arise, you may need to handle issues and emergencies, including rescheduling interviews and/or calls last minute•Organizing, updating, and maintaining documents and data•Scheduling meetings•Tracking and updating owners on business venture statusesFlexible to be part-time as well in the beginningShow moreShow less"
Deep Learning Scientist,Stealth,https://www.linkedin.com/jobs/view/deep-learning-scientist-at-stealth-3899689688?refId=HAfhANVRO1B3klBBR45yrw%3D%3D&trackingId=PKtlWm7ChoNG%2BiuK94gdrQ%3D%3D&position=4&pageNum=0&trk=public_jobs_jserp-result_search-card,"$500,000.00/yr - $700,000.00/yr","We are a distinguished firm known for our leading-edge research and development in the financial sector. With an emphasis on innovation and a collaborative culture, we strive to attract and nurture top-tier talent. Our workplace is crafted to encourage creativity and peak performance. At the heart of our operations is a commitment to a culture defined by collaboration, meritocracy, ambition, and determination—qualities that foster an ambitious and results-oriented atmosphere. Our investment strategies are systematic, supported by a robust research and development platform, with the goal of consistently delivering industry-leading returns.Vision:We value specialists who can immediately contribute and enhance our dynamic team with diverse skill sets and backgrounds. The computational models we are developing are becoming increasingly complex, and computational power is paramount.The Opportunity:Engage in an evolving environment that champions complexity and growth.Work at the forefront of machine learning, recognizing and harnessing its transformative potential.Thrive in a setting that combines the agility of a start-up with the stability of a well-funded entity—a perfect playground for innovation.Experience mid to long-term growth opportunities, including leading teams and spearheading technology initiatives.We Are Seeking:Talented deep learning scientists who are eager to create and refine proprietary trading models and strategies. Our scientists collaborate closely with engineers, researchers, and senior leaders, with the scope to undertake independent research and develop new research themes over time.Responsibilities Include:Employing financial and other data sources to construct or enhance predictive models.Utilizing state-of-the-art statistical and machine-learning models to bolster our R&D system.Designing algorithms to capitalize on predictive signals.Technical Qualifications:Advanced degree (PhD or Postdoc) in finance, computer science, mathematics, statistics, machine learning, physics, or a related scientific discipline.Strong mathematical, analytical, and problem-solving skills.Experience conducting high-level statistical or applied mathematical research.Prior quantitative trading environment experience is advantageous.Proficiency in programming with C++, Java, or Python.Show moreShow less"
